Id,Title,Description,Slug,Meta Title,Meta Description
127,Will the TC and weighment slips be shared with the invoice via email?,Test certificate and seller weighment slip will be shared by our operations team within 3 days of the order invoicing on your registered email address,will-the-tc-and-weighment-slips-be-shared-with-the-invoice-via-email,TC & Weighment Slips in Invoice: Dispatch - JSW One MSME,Learn if TC and weighment slips are included in the invoice emailed by JSWOne MSME. Get insights into dispatch and delivery processes for accurate documentation.
128,Why is my order not showing in my 'My Orders' section?,"If you cannot view order details in your 'My Orders' section after logging in, we urge you to contact your sales representative, or you can contact us at +91 7208055523 or support@jswonemsme.com. To access your orders on JSW One MSME, please follow the below steps.",why-is-my-order-not-showing-in-my-my-orders-section,Order Not Showing: My Orders Section - JSW One MSME,Find out why your order may not be appearing in the My Orders section on JSWOne MSME. Learn how to troubleshoot and resolve this issue for a seamless experience
129,How do I change the email address or phone number in my account?,"You cannot change your email addressed or phone number via the website once registered. You can register on JSW One MSME by clicking on 'Register' button at the top right of the website using another number or email address. In case you are looking to change your existing phone number or email address, please call us on +91 7208055523 or email us at support@jswonemsme.com.",how-do-i-change-the-email-address-or-phone-number-in-my-account,Change Email & Phone: Account Management - JSW One MSME,Discover how to update your email address or phone number in your JSWOne MSME account. Follow easy steps for managing your account information efficiently.
130,Can I place an export order through the website?,At this moment we do not have the facility to dispatch an order to an international address.,can-i-place-an-export-order-through-the-website,Export Orders: Product Enquiry - JSW One MSME,Discover how to place export orders through the JSWOne MSME website. Explore the process and benefits of ordering products for international shipments.
131,Can I get my order delivered at a specific time of day?,"At the moment, we cannot take time-specific requests.",can-i-get-my-order-delivered-at-a-specific-time-of-day,Specific Time Delivery: Order Information - JSW One MSME,Find out if you can get your orders delivered at a specific time of day with JSWOne MSME. Explore delivery options and time slots for your convenience.
132,How do I request for faster delivery?,Special delivery or order-related instructions can be added before the order is placed. Please get in touch with your sales representative for the same,how-do-i-request-for-faster-delivery,Request Faster Delivery: Ordering Information - JSW One MSME,Learn how to request faster delivery for your orders at JSWOne MSME. Get quick insights into the ordering process and expedited shipping options.
133,What to do If I receive a partial order/some items of my order?,"Please contact your sales representative to enquire about the same, or you can contact us at +91 7208055523 or support@jswonemsme.com.",what-to-do-if-i-receive-a-partial-order-some-items-of-my-order,JSW One MSME | Order Information: Dealing with Partial Order Delivery,Find out what to do if you receive a partial order with missing items from JSW One MSME's order information. Learn about our procedures for handling such situations.
134,Can I return part of the order I placed?,"Yes, you can return part of the order. Please go through the 'Return Policy' section to know more.",can-i-return-part-of-the-order-i-placed,JSW One MSME | Return Policy: Partial Order Returns,Discover if you can return part of the order you placed with JSW One MSME's return policy. Learn about our guidelines for partial order returns.
135,How much time will material delivery take?,"The delivery timeline may differ from one product to another. We usually deliver in 2-5 days; however, we urge you to check your order confirmation email for more details. Additionally, you can also contact your sales representative.",how-much-time-will-material-delivery-take,JSW One MSME | Dispatch and Delivery: Estimating Material Delivery Time,Learn about the estimated time for material delivery with JSW One MSME's dispatch and delivery service. Get insights into our delivery timelines.
136,How do I know that my order is confirmed?,"Once an order is confirmed, you will receive an order confirmation email on your registered email address.",how-do-i-know-that-my-order-is-confirmed,JSW One MSME | Dispatch and Delivery: Confirming Your Order Status,Find out how to confirm that your order is confirmed with JSW One MSME's dispatch and delivery service. Learn about our order confirmation process.
137,"I want to purchase a product, but it's unavailable online. What shall I do?",We are constantly updating our product catalogue. You can contact us at +91 7208055523 or support@jswonemsme.com with your catalogue request and we will get back to you.,i-want-to-purchase-a-product-but-its-unavailable-online-what-shall-i-do,JSW One MSME | Product Enquiry: Dealing with Product Unavailability,Discover steps to take when the product you want is unavailable online with JSW One MSME's product enquiry service. Explore options and solutions for your purchase.
138,Can I register multiple times using the same mobile number and email address?,Each email address and mobile number can only be used with one account.,can-i-register-multiple-times-using-the-same-mobile-number-and-email-address,JSW One MSME | Registration & Login: Multiple Registrations with Same Contact Details,Learn about JSW One MSME's policy on registering multiple times with the same mobile number and email address. Find out how we manage duplicate registrations
139,Can I get my order delivered to an alternate address after order confirmation?,"Change of address post-order confirmation will not be accepted. For more clarity, please feel free to speak to your sales representative.",can-i-get-my-order-delivered-to-an-alternate-address-after-order,JSW One MSME | Order Information: Delivery to Alternate Address,Find out if you can have your order delivered to an alternate address after placing it with JSW One MSME. Learn about our options and procedures for address changes.
140,How do I delete my company account?,Please call us on +91 7208055523 or email us at support@jswonemsme.com. We will help you.,how-do-i-delete-my-company-account,JSW One MSME | Registration & Login: Deleting Your Company Account,Learn how to delete your company account with JSW One MSME's step-by-step guide. Follow the instructions to remove your account securely.
141,Can I alter my order after it is confirmed?,Any order-related changes can be done before the order is placed. We cannot modify any part of the order post order confirmation.,can-i-alter-my-order-after-it-is-confirmed,JSW One MSME | Order Information: Modifying Confirmed Orders,Find out if you can make alterations to your confirmed order with JSW One MSME. Learn about our policies and procedures for order modifications.
142,I would like advice on what type of steel to use for the product I'm manufacturing. How do I get this?,"Please share your enquiry with us, our experienced team will connect with you. You can contact us on +91 7208055523 or email us at support@jswonemsme.com.",i-would-like-advice-on-what-type-of-steel-to-use-for-the-product-im,JSW One MSME | Product Enquiry: Steel Selection Advice,Seek expert advice on choosing the right type of steel for your product with JSW One MSME's product enquiry service. Get recommendations tailored to your needs.
143,What do I do if there is a mismatch in the ledger for my company account?,"In case of discrepancy, you can contact us at +91 7208055523 or email us at support@jswonemsme.com with a clear call out of the issue.",what-do-i-do-if-there-is-a-mismatch-in-the-ledger-for-my-company-account,JSW One MSME | Ledger: Handling Mismatche in Your Company Account,Discover what to do if there's a mismatch in the ledger for your company account with JSW One MSME's assistance. Get guidance for resolving discrepancies effectively.
144,How do I log into my account?,"If you have already registered with JSW One MSME, you can click on 'Login' and decide to login via email address or mobile OTP verification. You will be able to see 'Login' button at the top right of the website main navigation.",how-do-i-log-into-my-account,JSW One MSME | Registration & Login: How to Log Into Your Account,Learn the steps to log into your JSW One MSME account seamlessly. Access your account and manage your preferences with ease.
145,"How can I access detailed information about a product, e.g. product specifications?","You can browse the product description on product detail pages for chemical, mechanical and tolerance properties on the catalogue pages. To access the product detail pages, please click on product listings on the website. You can contact us on +91 7208055523 or email us at support@jswonemsme.com for more information.",how-can-i-access-detailed-information-about-a-product-e-g-product,"JSW One MSME |Steel, Cement, TMT Product Enquiry: Accessing Detailed Product Information","Discover how to access detailed information about products like steel, cement, tmt through JSW One MSME's product enquiry service. Get comprehensive product details effortlessly."
146,How do I get the quotation/price for the product I want?,"Please share your enquiry with us, our experienced team will connect with you. You can contact us on +91 7208055523 or email us at support@jswonemsme.com.",how-do-i-get-the-quotation-price-for-the-product-i-want,"JSW One MSME | Steel, Cement, TMT Inquiry: Requesting Quotation Price","Learn how to obtain a quotation price for the steel, cement or tmt product you want with JSW One MSME's product enquiry service. Get accurate pricing information easily."
147,How do I check the current status of my order?,"The operations team handles the order delivery coordination, they will contact you once your order is ready for dispatch. However, you can ask your sales representative or the order manager for more updates.",how-do-i-check-the-current-status-of-my-order,"JSW One MSME | How to Check your Order Status for Steel, TMT & Cement","Learn how to track your Steel, Cement, or TMT order status with JSW One MSME. Stay updated and follow your purchase journey seamlessly."
148,Can I return a product because I no longer need it?,"The buyer shall not be entitled to raise a request for return of the products (not being Disqualified Products) purchased on the platform for any reason other than For Cause Returns (“Other Reasons Returns”), including if you no longer need the product after placing an order for such product, subject to the other terms of the return policy.",can-i-return-a-product-because-i-no-longer-need-it,"JSW One MSME | Return Policy: Return Steel, TMT, Cement","Learn about JSW One MSME's return policy regarding steel, tmt, cement products you no longer need. Find out the guidelines and steps for returning such items."
