ID,Name,Title,Meta Title,Content
5uc9bmbMcFyzc9xKMGqcAA,JSW Seller Agreement - Terms & conditionsl,JSW Seller Agreement - Terms & conditions,JSW Seller Agreement - Terms & conditions," JOPL SELLER CONNECT POLICIES THESE SELLER CONNECT POLICIES FORM AN INTEGRAL PART OF THE SELLER AGREEMENT EXECUTED / TO BE EXECUTED BETWEEN THE SELLER AND JOPL (“SELLER AGREEMENT” / “AGREEMENT”). SELLER’S CONCURRENCE WITH THE SELLER AGREEMENT SHALL MEAN AGREEMENT WITH ALL THE TERMS AND CONDITIONS OF THE SELLER CONNECT POLICIES CONTAINED HEREUNDER WHICH INCLUDE THE (A) SELLER TERMS OF USE, (B) PROHIBITED AND RESTRICTED ITEMS POLICY, (C) SELLER CODE OF CONDUCT, (D) SELLER BLACKLISTING POLICY, (E) SELLER PRIVACY POLICY, AND SUCH OTHER POLICY DOCUMENTS AS MAY BE ISSUED AND PUBLISHED BY JOPL ON [ ] FROM TIME TO TIME (“SELLER CONNECT POLICIES”), AT ITS SOLE DISCRETION. PLEASE READ ALL THE SELLER CONNECT POLICIES CAREFULLY BEFORE PROCEEDING. BY ACCESSING OR USING THE PLATFORM AND/OR THIS SELLER CONNECT PLATFORM, YOU AGREE TO BE BOUND BY THE SELLER CONNECT POLICIES, AS MAY BE ADOPTED BY US FROM TIME TO TIME. PLEASE READ THE SELLER AGREEMENT AND THE SELLER CONNECT POLICIES CAREFULLY BEFORE ENTERING INTO A TRANSACTION AND/OR AVAILING ANY SELLER CONNECT SERVICES. THESE SELLER CONNECT POLICIES ARE SUPPLEMENTARY TO THE SELLER AGREEMENT AND ARE TO BE READ TOGETHER AS ONE DOCUMENT. THESE SELLER CONNECT POLICIES ARE ELECTRONIC RECORDS ISSUED UNDER THE INFORMATION TECHNOLOGY ACT, 2000 AND THE RULES THEREUNDER. THESE ELECTRONIC RECORDS ARE GENERATED BY A COMPUTER SYSTEM AND DO NOT REQUIRE ANY PHYSICAL OR DIGITAL SIGNATURES. THESE DOCUMENTS ARE PUBLISHED IN ACCORDANCE WITH THE PROVISIONS OF RULE 3 (1) OF THE INFORMATION TECHNOLOGY (INTERMEDIARIES GUIDELINES AND DIGITAL MEDIA ETHICS CODE) RULES, 2021 THAT REQUIRE PUBLISHING THE RULES AND REGULATIONS, PRIVACY POLICY AND TERMS OF USE FOR ACCESS TO OR USAGE OF THE PLATFORM. ALL SELLER CONNECT POLICIES ARE LEGALLY BINDING DOCUMENTS.  SELLER TERMS OF USE (TOU) - SToU V 3.0 Using the Seller Connect Platform indicates Seller’s agreement with all the terms and conditions of the Seller Agreement and Seller Connect Policies. By implicitly or expressly accepting the ToU, you also accept and agree to be bound by (including Privacy Policy), as amended, from time to time.  PROHIBITED & RESTRICTED ITEMS POLICY (PRIP V 3.0) Before a Seller lists an item, the Seller needs to find out if the item is allowed to be sold on the Platform as per the terms of the Seller Agreement and if the type of item is subject to certain restrictions, to avoid potential issues with Seller listing. As a Seller, you are ultimately responsible for making sure that selling an item is legal under Applicable Laws. Violations of this Policy may result in a range of actions, including the following: When Policy violations occur, JOPL may email the Seller as well as the Customer that a listing has been ended. You may contact JOPL to report violations by sending an email to . Rules on Prohibited and Restricted Items Policies about listing items are generally guided by the applicable law in force. However, many items that are not necessarily prohibited by law have been termed as prohibited and restricted in the list below as they may involve the sale of dangerous or sensitive items. The limitations are a result of the input by numerous stakeholders, including the community. It is also important to respect third-party intellectual property rights and Sellers must have legal rights to sell Products they list. Prohibited and Restricted Items List:* *The above list is merely indicative and not exhaustive. JOPL may at its sole discretion, amend or modify this list.  SELLER CODE OF CONDUCT (SCoC V 3.0) Seller shall comply and ensure that its logistic partner complies (Seller and its logistics partner hereinafter collectively, solely for the purposes of this Code of Conduct, referred to as the “ Parties ”) with the following Code of Conduct at all times.   SELLER BLACKLISTING POLICY (SBP V 3.0) The Seller Blacklisting Policy has been designed to maintain standards and ensure consistent quality at JOPL. In addition, the Policy is also applicable in cases related to behavioural issues (personal or company level) or violation of specific policies listed out by JOPL. The following reasons would lead to blacklisting of a Seller:   SELLER PRIVACY POLICY (SPP V 3.0) In accordance with the SPDI Rules, any sensitive personal data or information of a person means and includes such personal information about that person relating to: Certain information provided by you may allow for your personal identification, including email addresses, telephone numbers and other contact information. It may be noted that any information that is freely available in the public domain or accessible under the Right to Information Act, 2005, or any other law will not be regarded as sensitive personal data or information, or as personally identifiable information. "
