ID,Name,Title,Meta Title,Meta Description,Canonical,Contentful ID,Mapping Name,Content Menu,Content
3,JSW Help Support - JSW Help and Support,Help and Support - JSW One MSME,"JSW One MSME Help & Support: Get Assistance for Registration, Orders, and More","Explore JSW One MSME's help & support page for help with registration, login, orders, product inquiries, and more. Contact us at 7208055523 for personalized assistance.",https://www.jswonemsme.com/help-support,3x9WgW6azR0Y0tKf1gYpM2,help_and_support,N/A,N/A
4,Sitemap,Sitemap,Sitemap | JSW One MSME,"Looking to buy industrial materials like steel, welding consumables, TMT, and cement online? Click here to visit us now or contact us at 7208055523.",https://www.jswonemsme.com/sitemap,3ynHqxSwoag0NySSQARtOw,sitemap,N/A,N/A
